User Input,Chatbot Response,Timestamp
Comedy,Catch-22 by Joseph Heller,2024-12-10 23:26:12
Horror,Bird Box by Josh Malerman,2024-12-10 23:26:15
Tragedy,The Kite Runner by Khaled Hosseini,2024-12-10 23:26:18
literature books,Frankenstein by Mary Shelley,2024-12-10 23:26:25
thank you,Thank you for chatting with me. Have a great day!,2024-12-10 23:26:32
Suspense,Sherlock Holmes by Arthur Conan Doyle,2024-12-10 23:27:29
Biography,The Glass Castle by Jeannette Walls,2024-12-10 23:27:33
thank you,Thank you for chatting with me. Have a great day!,2024-12-10 23:27:38
